### ISSUE TITLE
Core: невозможно переподключиться к серверу

### ISSUE THREAD

**Issue by xin0nix** [xin0nix/road-n-roll#23]
Core: невозможно переподключиться к серверу

Выглядит следующим образом:

1. Запускаем Core один раз, успешно подключаемся и получаем ответ
2. Перезапускаем Core, он выдаёт ошибку 
3. Через некоторое время можно вернуться к шагу 1 (успешный запуск), то есть проблема через некоторое время исчезает

Ошибка:
```
Address already in use [system:98 at /home/joe/src/road-n-roll/core/build/clang-debug/_deps/boost-src/libs/asio/include/boost/asio/detail/reactive_socket_service.hpp:161:33 in function 'boost::system::error_code boost::asio::detail::reactive_socket_service<boost::asio::ip::tcp>::bind(implementation_type &, const endpoint_type &, boost::system::error_code &) [Protocol = boost::asio::ip::tcp]']
```

Вывод `tcpdump`
```
$ sudo tcpdump -i lo port 8080 -nn -v
tcpdump: listening on lo, link-type EN10MB (Ethernet), snapshot length 262144 bytes
05:18:53.420219 IP (tos 0x0, ttl 64, id 42200, offset 0, flags [DF], proto TCP (6), length 60)
    127.0.0.1.35654 > 127.0.0.1.8080: Flags [S], cksum 0xfe30 (incorrect -> 0x2e40), seq 1491767137, win 65495, options [mss 65495,sackOK,TS val 2468543356 ecr 0,nop,wscale 7], length 0
05:18:53.420228 IP (tos 0x0, ttl 64, id 0, offset 0, flags [DF], proto TCP (6), length 60)
    127.0.0.1.8080 > 127.0.0.1.35654: Flags [S.], cksum 0xfe30 (incorrect -> 0x8799), seq 105910706, ack 1491767138, win 65483, options [mss 65495,sackOK,TS val 2468543356 ecr 2468543356,nop,wscale 7], length 0
05:18:53.420236 IP (tos 0x0, ttl 64, id 42201, offset 0, flags [DF], proto TCP (6), length 52)
    127.0.0.1.35654 > 127.0.0.1.8080: Flags [.], cksum 0xfe28 (incorrect -> 0xae55), ack 1, win 512, options [nop,nop,TS val 2468543356 ecr 2468543356], length 0
05:18:53.423193 IP (tos 0x0, ttl 64, id 42202, offset 0, flags [DF], proto TCP (6), length 219)
    127.0.0.1.35654 > 127.0.0.1.8080: Flags [P.], cksum 0xfecf (incorrect -> 0x72ad), seq 1:168, ack 1, win 512, options [nop,nop,TS val 2468543359 ecr 2468543356], length 167: HTTP, length: 167
        POST /games HTTP/1.1
        Host: localhost:8080
        Content-Length: 0
        Accept: */*
        Accept-Encoding: gzip, deflate
        Connection: keep-alive
        User-Agent: python-httpx/0.28.1

05:18:53.423217 IP (tos 0x0, ttl 64, id 30631, offset 0, flags [DF], proto TCP (6), length 52)
    127.0.0.1.8080 > 127.0.0.1.35654: Flags [.], cksum 0xfe28 (incorrect -> 0xada9), ack 168, win 511, options [nop,nop,TS val 2468543359 ecr 2468543359], length 0
05:18:53.424549 IP (tos 0x0, ttl 64, id 30632, offset 0, flags [DF], proto TCP (6), length 126)
    127.0.0.1.8080 > 127.0.0.1.35654: Flags [P.], cksum 0xfe72 (incorrect -> 0x3167), seq 1:75, ack 168, win 512, options [nop,nop,TS val 2468543360 ecr 2468543359], length 74: HTTP, length: 74
        HTTP/1.1 404 Not Found
        Server: Core
        Content-Type: application/json

        {} [|http]
05:18:53.424578 IP (tos 0x0, ttl 64, id 42203, offset 0, flags [DF], proto TCP (6), length 52)
    127.0.0.1.35654 > 127.0.0.1.8080: Flags [.], cksum 0xfe28 (incorrect -> 0xad5c), ack 75, win 512, options [nop,nop,TS val 2468543360 ecr 2468543360], length 0
05:18:53.424654 IP (tos 0x0, ttl 64, id 30633, offset 0, flags [DF], proto TCP (6), length 52)
    127.0.0.1.8080 > 127.0.0.1.35654: Flags [F.], cksum 0xfe28 (incorrect -> 0xad5b), seq 75, ack 168, win 512, options [nop,nop,TS val 2468543360 ecr 2468543360], length 0
05:18:53.427858 IP (tos 0x0, ttl 64, id 42204, offset 0, flags [DF], proto TCP (6), length 52)
    127.0.0.1.35654 > 127.0.0.1.8080: Flags [F.], cksum 0xfe28 (incorrect -> 0xad57), seq 168, ack 76, win 512, options [nop,nop,TS val 2468543363 ecr 2468543360], length 0
05:18:53.427876 IP (tos 0x0, ttl 64, id 30634, offset 0, flags [DF], proto TCP (6), length 52)
    127.0.0.1.8080 > 127.0.0.1.35654: Flags [.], cksum 0xfe28 (incorrect -> 0xad54), ack 169, win 512, options [nop,nop,TS val 2468543363 ecr 2468543363], length 0
05:19:07.029437 IP (tos 0x0, ttl 64, id 44926, offset 0, flags [DF], proto TCP (6), length 60)
    127.0.0.1.48050 > 127.0.0.1.8080: Flags [S], cksum 0xfe30 (incorrect -> 0x4d11), seq 2857616271, win 65495, options [mss 65495,sackOK,TS val 2468554407 ecr 0,nop,wscale 7], length 0
05:19:07.029446 IP (tos 0x0, ttl 64, id 0, offset 0, flags [DF], proto TCP (6), length 40)
    127.0.0.1.8080 > 127.0.0.1.48050: Flags [R.], cksum 0x68a7 (correct), seq 0, ack 2857616272, win 0, length 0
```
